"signal","domain","telemetry_source","rationale","mapped_ICICI_Lombard_products"
"Integration as a seller or buyer node on the ONDC network","Liability","Public business event / public disclosures","Subjects the startup to ONDC Issue and Grievance Management (IGM) and Online Dispute Resolution (ODR), creating multi-party accountability for product defects across a decentralized network.","ICICI Lombard Commercial General Liability (CGL) and Product Liability for third-party indemnifications arising from binding ODR settlements."
"Launching digital educational or interactive gaming modules targeting users under 18","Liability","Public business event / public disclosures","Triggers the highest protection tier of DPDP Rules 2025. Processing children's data without verifiable parental consent can create severe statutory penalty exposure, including penalties up to INR 200 crore per instance.","Cyber Liability with regulatory fines sub-limits, plus Directors and Officers (D&O) Liability for statutory defense costs."
"Publicly updating Terms of Service to include automated third-party AI or LLM decision-making","Liability","Public business event / public disclosures","Use of large language models for customer advisory introduces algorithmic bias and hallucination risks, which can lead to professional negligence claims if AI gives materially incorrect operational advice.","Errors and Omissions (E&O) / Professional Indemnity for technology services and automated advisory failures."
"Executing sublease agreements to monetize excess commercial real estate to unaffiliated micro-entities","Liability","Public business event / public disclosures","Converts the startup from a standard commercial tenant into a de facto commercial landlord, creating premises liability for bodily injury, fire spread, and damage caused by unvetted sub-tenants.","Commercial General Liability (CGL) with endorsements for sub-tenancy and extended premises liability."
"Appointing an external high-profile Data Protection Officer and announcing a compliance overhaul","Liability","Public business event / public disclosures","Publicly indicates a transition toward Significant Data Fiduciary obligations under the DPDP Act. The DPO mandate may expose historical data architecture breaches requiring regulatory response.","D&O Liability for the DPO and board, plus Cyber Liability."
"Pivoting from software-only SaaS to distributing white-labeled consumer hardware","Liability","Public business event / public disclosures","Moves the primary exposure from intangible software and data risk to bodily injury, property damage, product defect, and strict liability risks.","Product Liability, transitioning the account away from a purely technology E&O exposure profile."
"Initiating registration with the DPBI to operate as an authorized Consent Manager","Cyber and Financial Lines","Public business event / public disclosures","Enters a regulated intermediary class requiring net worth, audits, interoperability, and high uptime. Downtime or security failure can create multi-party data exposure.","Cyber Liability with higher capacity, plus E&O for systemic platform failures."
"Deploying checkout finance or BNPL through a regulated NBFC partner","Cyber and Financial Lines","Public business event / public disclosures","Can classify the startup as a Lending Service Provider under RBI digital lending guidelines. UI, consent, disclosure, or Key Fact Statement failures can compromise partner NBFC compliance.","E&O / Technology Professional Liability for non-compliant financial infrastructure."
"Publishing and open-sourcing proprietary internal API infrastructure to developer communities","Cyber and Financial Lines","Public business event / public disclosures","Expands digital attack surface. Vulnerabilities in open-source code can enable data exfiltration, DPDP violation notices, and reputational damage.","Cyber Liability for third-party breach response, forensics, and notification expenses."
"Migrating enterprise architecture from centralized on-premise servers to multi-cloud federated environments","Cyber and Financial Lines","Public business event / public disclosures","Data migration creates peak vulnerability. Misconfigured cloud access permissions are a common vector for major data breaches and mandatory breach reporting.","Cyber Liability with underwriting review of cloud security posture and incident response readiness."
"Mandating facial recognition or advanced biometric onboarding for application access","Cyber and Financial Lines","Public business event / public disclosures","Escalates the entity into highly sensitive personal data processing. Biometric breach creates irreversible privacy harm and higher regulatory sensitivity.","Cyber Liability with policy language addressing biometric data exposure and statutory penalty response."
"Announcing integration with TReDS platforms to discount MSME invoices as a supplier","Cyber and Financial Lines","Public business event / public disclosures","Indicates working-capital pressure and receivables monetization. Exposes the business to buyer default, counter-party failure, and factoring-chain risk.","Trade Credit Insurance against non-payment, insolvency, and protracted default."
"Retrofitting offices with captive lithium-ion battery banks for UPS or power backup","Property and Engineering","Public business event / public disclosures","Creates severe localized fire risk. Lithium-ion thermal runaway is difficult to suppress with standard office sprinkler systems and can endanger the entire building.","Fire and Burglary / SME Package with engineering warranties for Battery Management Systems (BMS)."
"Installing heavy liquid-immersion cooling infrastructure in standard server rooms","Property and Engineering","Public business event / public disclosures","Signals major compute-density scale-up, often for AI. Introduces liquid damage and short-circuit risks to high-value electronic equipment.","Electronic Equipment Insurance (EEI) and Commercial Property with bespoke coverage for leakage and short circuits."
"Commissioning high-voltage captive solar rooftops on leased operational assets","Property and Engineering","Public business event / public disclosures","Alters structural load and introduces installation-phase construction risk. Faulty high-voltage wiring can drive industrial fire exposure.","Erection All Risks (EAR) during installation, converting to Fire and Perils after commissioning."
"Procuring automated robotic sorting arms for micro-fulfillment centers","Property and Engineering","Public business event / public disclosures","High-capex machinery creates breakdown risk. Failure can halt fulfillment operations immediately and trigger business interruption losses.","Machinery Breakdown and Contractor's Plant and Machinery (CPM)."
"Leasing a recognized heritage building for a flagship retail experience center","Property and Engineering","Public business event / public disclosures","Heritage properties may lack modern fire compartmentalization, sprinkler systems, and structural resilience, creating asymmetric property risk.","Commercial Property Insurance with higher underwriting scrutiny and premium loading."
"Implementing dense server-rack deployments in standard office spaces without industrial HVAC","Property and Engineering","Public business event / public disclosures","High-density compute clusters in non-data-center environments can overheat, increasing electrical fire and cascading hardware failure risk.","Fire and Perils plus Electronic Equipment Insurance (EEI)."
"Mandating a non-negotiable five-day return-to-office policy after remote work","Employee Benefits","Public business event / public disclosures","Abrupt work-condition changes can trigger resignations, mental health claims, and constructive dismissal or discriminatory enforcement allegations.","D&O with Employment Practices Liability (EPLI) extensions, plus Group Health Insurance."
"Registering gig workers under the Karnataka Platform-Based Gig Workers Welfare Board","Employee Benefits","Public business event / public disclosures","Publicly acknowledges aggregator status and welfare obligations. Triggers welfare fees, termination protocols, and state-monitored grievance mechanisms.","Workmen's Compensation and Group Personal Accident (GPA)."
"Deploying field sales or logistics teams to high-altitude or severe-climate Tier-3 regions","Employee Benefits","Public business event / public disclosures","Shifts people risk from controlled office environments to geographies with road, disease, climate, and medical access risks.","Group Personal Accident and Group Health Insurance with geographic coverage endorsements."
"Announcing workforce restructuring or downsizing above 15 percent of headcount","Employee Benefits","Public business event / public disclosures","Mass layoffs can lead to wrongful termination, discrimination, contract violation, and board-level litigation.","D&O Liability with robust EPLI extensions."
"Introducing mandatory extreme outdoor activities for team-building events","Employee Benefits","Public business event / public disclosures","Company-sponsored events outside normal office hazards introduce severe bodily injury and fatality risk.","Group Personal Accident and Workmen's Compensation."
"Moving sales teams to heavily commissioned performance-only compensation","Employee Benefits","Public business event / public disclosures","High-pressure compensation models can increase workplace stress, toxic culture claims, unethical sales conduct, and regulatory scrutiny.","D&O with EPLI, plus E&O for mis-selling risks."
"Replacing owned last-mile delivery fleet with second-hand refurbished electric vehicles","Transit and Motor","Public business event / public disclosures","Second-hand EV batteries may have degraded cells, increasing thermal runaway risk during charging or collision and endangering drivers, goods, and public infrastructure.","Commercial Motor Fleet with battery-age underwriting, BIS AIS-156 compliance review, and fire-exclusion scrutiny."
"Moving from centralized Tier-1 logistics provider to fragmented regional 3PL network","Transit and Motor","Public business event / public disclosures","Reduces chain-of-custody visibility and standardization, increasing cargo theft, mishandling, delay, and safety protocol gaps.","Marine Transit / Inland Transit with optimized retentions and higher deductibles."
"Extending B2B credit payment terms from 30 days to 90 days for distributor networks","Transit and Motor","Public business event / public disclosures","Can signal working-capital strain and increases counter-party default exposure over a longer credit window.","Trade Credit Insurance for distributor insolvency or protracted default."
"Deploying customized mobile experience vans for localized experiential marketing","Transit and Motor","Public business event / public disclosures","Combines commercial motor exposure with public footfall and event-like liability around moving assets.","Commercial Motor Fleet and Commercial General Liability (CGL)."
"Piloting autonomous floor-cleaning robots in partner retail environments","Transit and Motor","Public business event / public disclosures","Autonomous machinery in public spaces creates third-party injury and property damage risk from sensor, navigation, or control failure.","Commercial General Liability (CGL) and Product Liability."
"Implementing a hyper-aggressive 10-minute delivery SLA for local perishables","Transit and Motor","Public business event / public disclosures","Aggressive SLAs can pressure gig riders into traffic violations, route shortcuts, and unsafe behavior, increasing road accident and third-party damage frequency.","Commercial Motor Fleet and Group Personal Accident for rider networks."
"Escalation in ODR arbitration ticket volumes","Liability","ONDC Public Registry / DRO Postings","Signifies a systemic breakdown in Level 1 automated grievance redressal. Breaching the 30-day Consumer Protection mandate precipitates regulatory fines and consumer class actions.3","Professional Indemnity / Tech E\&O, Public Liability, I-select Liability"
"Deprecation of legacy custom loan matching algorithms","Liability","GitHub commits / API Changelogs","Suggests forced, reactive compliance with the RBI November 2025 multi-lender impartiality rules. Previous algorithmic bias indicates latent regulatory scrutiny and D\&O exposure.6","D\&O, Financial Services PI, Corporate Cover II"
"UI/UX overhauls removing countdown timers and default opt-ins","Liability","Web scraping of checkout flows","Removal of ""dark patterns"" to comply with strict RBI lending rules.6 Reactive removal implies historical deceptive practices that likely accumulated unresolved consumer complaints.","Tech E\&O, D\&O, Enterprise Secure Package Policy"
"Surge in ""Internal Dispute Resolution Committee"" (IDRC) escalations","Liability","Employee/Gig Worker review sites NLP","High volume of IDRC reviews under the Karnataka Gig Worker Bill indicates severe platform-worker friction, predicting mass mobilization and employment practice litigation.7","Employment Practices Liability, Employers Compensation, Business Shield SME"
"Severe volatility in ONDC Reputation Ledger scoring","Liability","ONDC Network Participant API","A sudden drop in a seller app's reputation score implies systemic fulfillment failures or product quality degradation, serving as a leading indicator of mass product recall or liability claims.5","Product Liability, Public Liability, Merchants Cover III"
"Implementation of dynamic matching and APR disclosures","Liability","DLA (Digital Lending App) APK teardowns","Indicates compliance with RBI rules requiring display of matched/unmatched offers and Annual Percentage Rates.6 Delayed implementation constitutes a critical D\&O and professional indemnity risk.","Financial Services PI, D\&O, Business Shield SME"
"Spikes in unrecorded cash recovery complaints","Liability","Consumer forums / Social media NLP","RBI mandates that physical cash recoveries by LSPs be recorded same-day.6 Complaints signal rogue recovery agents, placing ultimate liability on the partnering Regulated Entity.","Crime / Fidelity, Financial Services PI, D\&O"
"High frequency shifts in designated Dispute Resolution Officers","Liability","LinkedIn / Corporate site scraping","Rapid turnover of DROs appointed for ONDC mediation implies an unmanageable volume of edge-case disputes and toxic corporate governance.3","Tech E\&O, D\&O, Employment Practices Liability"
"Algorithmic vetoes invoked on throttling radius reductions","Liability","Welfare Board public minutes (Karnataka)","Under Karnataka law, the board holds advisory vetoes on algorithmic changes impacting safety (e.g., radius reductions \>20%).8 A public veto signals acute platform safety violations.","Employers Compensation, Public Liability, CGL / I-Elite"
"Discrepancies between advertised and sanctioned loan tenors","Liability","Crowdsourced lending transparency portals","Failure to align the Key Facts Statement (KFS) with final API outputs violates RBI multi-lender disclosure mandates, triggering immediate regulatory intervention.6","Tech E\&O, Financial Services PI, Enterprise Secure Package"
"Surge in Secondary Network Participant ODR opt-outs","Liability","ONDC Network Participant Registry","Entities opting out of ODR mechanisms face network suspension, implying severe impending revenue loss and business interruption.1","Business Interruption, D\&O, Corporate Cover II"
"Delayed DLA reporting to the RBI CIMS portal","Liability","RBI CIMS mismatch notices","Failure by the RE's Chief Compliance Officer to formally certify Digital Lending App compliance by the June 2025 deadline triggers massive statutory liability.6","D\&O, Cyber, Financial Services PI"
"App store rating drops correlated with ""recovery agent"" keyword density","Liability","NLP sentiment analysis of App Stores","Early warning telemetry of LSP aggressive recovery tactics, directly violating RBI outsourcing guidelines and creating absolute RE liability.6","Public Liability, Crime / Fidelity, I-select Liability"
"Unexplained revocation of API access for specific aggregators","Liability","Platform developer portals","Suggests a termination event due to non-compliance with fair practices codes, signaling imminent litigation between Lending Service Providers and Regulated Entities.","Tech E\&O, CGL / I-Elite, MSME Suraksha Kavach"
"Rapid, post-deadline updates to Terms of Service agreements","Liability","Wayback Machine / Legal page monitoring","Reactive legal patching following the enforcement of the RBI multi-lender rules (Nov 2025), indicating deeply flawed prior due diligence.6","D\&O, Professional Indemnity / Tech E\&O"
"Inclusion of ""ODR Binding Arbitration"" clauses in baseline T\&Cs","Liability","T\&C text tracking algorithms","Preemptive legal shielding by ONDC sellers anticipating high dispute volumes under the new grievance policy 3, indicating a high-risk product portfolio.","CGL / I-Elite, Product Liability"
"Spikes in ""impartiality metric"" documentation revisions","Liability","Open API documentation","RBI requires documented, consistent loan matching.6 Frequent, erratic updates suggest the algorithmic methodology is repeatedly failing internal regulatory stress tests.","Financial Services PI, Tech E\&O, Business Shield SME"
"Sudden architectural shifts in LSP fee collection flows","Liability","Fintech payment flow analysis","RBI mandates REs pay LSPs directly; LSPs cannot deduct fees from borrowers.6 Abrupt flow changes indicate prior non-compliance and impending regulatory fines.","Crime / Fidelity, Financial Services PI"
"Revisions to third-party risk disclosure metrics in filings","Liability","Investor presentations / Quarterly results","Fintech NBFCs altering partnership revenue exposure metrics due to RBI restructuring requirements.9 Sudden shifts indicate underlying partnership instability.","D\&O, Trade Credit, Corporate Cover II"
"Disclaimers of ""RBI Endorsement"" suddenly appearing on DLAs","Liability","Web scraping of lending landing pages","Corrective action against misusing Centralised Information Management System (CIMS) reporting to imply RBI backing, a strict violation of the 2025 guidelines.6","Public Liability, Tech E\&O"
"Activation of edge-case ONDC network investigations","Liability","ONDC official publications","ONDC taking over dispute investigation implies the Buyer and Seller Apps failed the 48-hour response and 30-day resolution SLA, exposing both to consumer protection actions.4","Professional Indemnity / Tech E\&O"
"Public notices of DLA delisting by Regulated Entities","Liability","RE official website scraping","REs severing ties with LSPs due to technical or statutory due diligence failures under the new RBI mandate, signaling extreme operational disruption.6","D\&O, Business Interruption, Business Edge Policy"
"Algorithmic changes in penalty charge calculation modules","Liability","Fintech API endpoints","Immediate adjustments to ensure penal charges are displayed accurately in the matched loan view, reacting to RBI disclosure audits.6","Financial Services PI, I-select Liability"
"Spike in conciliation officer appointments","Liability","State Labour Department gazettes","Platforms staffing up rapidly to handle Karnataka Gig Worker Act dispute mandates, preparing for the strict 90-day adjudication limit at Labour Tribunals.8","Employment Practices Liability, CGL / I-Elite"
"Revisions to automated monitoring disclosures in worker apps","Liability","Gig worker app APKs","Aggregators updating how they inform workers about algorithmic decisions to comply with the transparency mandates of the 2025 Karnataka ordinance.11","Tech E\&O, Employers Compensation, Group Safeguard"
"Surge in job postings for ""Consent Manager Integration Specialists""","Cyber & Financial Lines","LinkedIn / Tech hiring boards","Reactive hiring ahead of the November 2026 Consent Manager deadline.13 Indicates a lack of internal readiness for Phase II DPDP compliance, exposing the firm to severe operational bottlenecks.","Cyber, D\&O, Business Shield SME"
"Database synchronization latency metrics exceeding 20 hours","Cyber & Financial Lines","Public cloud status pages / BGP routing","Approaching the strict RBI 24-hour maximum threshold for returning and deleting digital lending data from foreign servers.6 Breaching 24 hours triggers immediate RBI censure.","Cyber, Financial Services PI, Enterprise Secure Package"
"Abrupt implementation of Aadhar/DigiLocker API hooks for age-gating","Cyber & Financial Lines","Mobile app APK analysis","Deployment of verification tools indicates the platform is actively processing children's data, requiring verifiable parental consent to avoid ₹200 crore DPDP penalties.17","Cyber, D\&O, Tech E\&O"
"Publication of DPO contact information on corporate homepages","Cyber & Financial Lines","Website footprinting","A regulatory trigger indicating the entity has crossed the threshold into ""Significant Data Fiduciary"" (SDF) status, activating stringent audit and DPIA liabilities.13","Cyber, D\&O, Crime / Fidelity, IAR Policy"
"Spike in third-party DPIA vendor procurements","Cyber & Financial Lines","Public B2B procurement portals","SDFs attempting to rush mandatory annual Data Protection Impact Assessments.19 Rushed, poorly scoped audits highly correlate with missed vulnerabilities and future breaches.","Cyber, Professional Indemnity / Tech E\&O"
"Deprecation of ""Legitimate Use"" processing clauses in Privacy Policies","Cyber & Financial Lines","Version control of legal texts","Indicates a forced shift from GDPR-style broad lawful bases to DPDP's strict consent-driven architecture.15 Points to massive legacy data mapping risks and potential illegal retention.","Cyber, D\&O, CGL / I-Elite"
"Integration of algorithmic fairness assessment modules","Cyber & Financial Lines","Open-source data science libraries","SDFs deploying fairness assessments as mandated by DPDP Rules.17 Failure in these modules invites algorithmic discrimination lawsuits and regulatory intervention.","Tech E\&O, Cyber, Employment Practices Liability"
"Sudden rollout of ""Itemized Consent Notices"" across UI","Cyber & Financial Lines","Web UX tracking","Transitioning to DPDP-compliant multi-lingual (Eighth Schedule) notices.16 Clunky implementation increases withdrawal rates, threatening core data monetization models.","Cyber, Business Interruption, Corporate Cover II"
"Data deletion logic updates hardcoding ""3-year interaction"" triggers","Cyber & Financial Lines","GitHub code commits","E-commerce and social media fiduciaries implementing the mandatory 3-year data deletion rule for inactive users.17 Bugs in this logic lead to illegal data retention.","Cyber, D\&O, Corporate Cover II"
"Implementation of DPB complaint API endpoints","Cyber & Financial Lines","Developer SDKs","Organizations building direct conduits to the Data Protection Board digital grievance portal.14 High API traffic directly signals mass consumer privacy complaints.","Cyber, D\&O, Public Liability"
"Deployment of multi-factor dynamic authentication SDKs","Cyber & Financial Lines","FinTech mobile updates","Rushing to meet the RBI April 1, 2026 deadline for dynamic authentication on non-card-present transactions.20 Integration failures halt transaction processing.","Cyber, Financial Services PI, Crime / Fidelity"
"Mass removal of third-party ad-tracking cookies","Cyber & Financial Lines","Browser extension telemetry","Attempting to mitigate ""targeted advertising directed at children,"" which is explicitly and completely prohibited under the DPDP Act.18","Cyber, D\&O, Tech E\&O"
"Re-permissioning campaigns dispatched to legacy user bases","Cyber & Financial Lines","Email marketing metadata","Sending notices to users to re-establish consent for data collected prior to the DPDP Act enactment.16 Low opt-in rates threaten enterprise valuation and data utility.","D\&O, Business Interruption"
"Activation of ""Right to Nominate"" interface flows","Cyber & Financial Lines","App UI updates","Compliance with the DPDP provision allowing data principals to nominate heirs for data rights in the event of death or incapacity.17 Presents complex data lifecycle management risks.","Cyber, Tech E\&O"
"Data mapping tool integrations applied to legacy enterprise systems","Cyber & Financial Lines","Tech stack intelligence (e.g., BuiltWith)","KPMG identifies incomplete data mapping across legacy systems as a primary transition risk.21 Late integration signals severe blind spots in cross-border data flows.","Cyber, Business Shield SME"
"Public notices of ""Outsourcing Exemption"" restructuring","Cyber & Financial Lines","Corporate legal filings","Indian BPOs restructuring operations to claim exemptions when processing foreign data.15 Misclassification leads to devastating dual-jurisdiction regulatory penalties.","D\&O, Professional Indemnity"
"Sudden strict separation of employee data silos","Cyber & Financial Lines","HR SaaS telemetry","Reacting to DPDP limitations preventing the use of employee data for unrelated commercial purposes without explicit secondary consent.15","Employment Practices Liability, Cyber"
"Spikes in ""72-hour breach"" keyword traffic on legal portals","Cyber & Financial Lines","SEO/Traffic analytics of law firms","Enterprises experiencing a latent data breach seeking rapid legal counsel to avoid the massive ₹200 crore non-notification penalty.14","Cyber, Crime / Fidelity, D\&O"
"Removal of ""Dark Patterns"" from consent withdrawal flows","Cyber & Financial Lines","UX dark pattern scanners","Fixing asymmetric consent withdrawal (making it harder to withdraw than to give consent), a strict focus of DPB scrutiny and Phase I enforcement.16","Cyber, Tech E\&O"
